### ISSUE TITLE
UDP hole punching not working

### ISSUE THREAD

**Issue by grebenyukaa** [RMerl/asuswrt-merlin.ng#139]
UDP hole punching is not working at random. I'd say it is succesful 1 out of 20 times. The problem is experienced with the game "rise of nations", but can supposedly be reproduced on a dummy hole punching test. If DMZ is enabled or port forwarding for the entire UDP port range (1025:65535) is set the problem is not experienced.

asuswrt-merlin version: 384.4_2

> uname -a
> Linux RT-AC68U-FC50 2.6.36.4brcmarm #1 SMP PREEMPT Sat Mar 24 13:10:20 EDT 2018 armv7l ASUSWRT-Merlin

tcpdump, showing port unreachable errors, when ports are not forwarded manually, where 128.72.252.146 is my machine and 37.144.211.31 is the other machine.

> tcpdump -i eth0 | grep 37.144.211.31
tcpdump: verbose output suppressed, use -v or -vv for full protocol decode
listening on eth0, link-type EN10MB (Ethernet), capture size 262144 bytes
19:55:47.049143 IP 128-72-252-146.broadband.corbina.ru.1024 > 37-144-211-31.broadband.corbina.ru.61136: UDP, length 136
19:55:49.248142 IP ns4.corbina.net.domain > 128-72-252-146.broadband.corbina.ru.19007: 50721 1/0/0 PTR 37-144-211-31.broadband.corbina.ru. (92)
19:55:51.203136 IP 37-144-211-31.broadband.corbina.ru.61137 > 128-72-252-146.broadband.corbina.ru.61871: UDP, length 132
19:55:51.203277 IP 128-72-252-146.broadband.corbina.ru > 37-144-211-31.broadband.corbina.ru: ICMP 128-72-252-146.broadband.corbina.ru udp port 61871 unreachable, length 168
19:55:53.202190 IP 37-144-211-31.broadband.corbina.ru.61137 > 128-72-252-146.broadband.corbina.ru.61871: UDP, length 132
19:55:53.202299 IP 128-72-252-146.broadband.corbina.ru > 37-144-211-31.broadband.corbina.ru: ICMP 128-72-252-146.broadband.corbina.ru udp port 61871 unreachable, length 168
19:55:53.924978 IP 128-72-252-146.broadband.corbina.ru.1024 > 37-144-211-31.broadband.corbina.ru.61137: UDP, length 136
19:55:54.965215 IP 128-72-252-146.broadband.corbina.ru.1024 > 37-144-211-31.broadband.corbina.ru.61137: UDP, length 136
19:56:02.615721 IP 37-144-211-31.broadband.corbina.ru.61138 > 128-72-252-146.broadband.corbina.ru.39488: UDP, length 132
19:56:02.615821 IP 128-72-252-146.broadband.corbina.ru > 37-144-211-31.broadband.corbina.ru: ICMP 128-72-252-146.broadband.corbina.ru udp port 39488 unreachable, length 168
19:56:02.895813 IP 128-72-252-146.broadband.corbina.ru.1024 > 37-144-211-31.broadband.corbina.ru.61138: UDP, length 136
19:56:13.614759 IP 37-144-211-31.broadband.corbina.ru.61139 > 128-72-252-146.broadband.corbina.ru.20270: UDP, length 132
19:56:13.614880 IP 128-72-252-146.broadband.corbina.ru > 37-144-211-31.broadband.corbina.ru: ICMP 128-72-252-146.broadband.corbina.ru udp port 20270 unreachable, length 168

on the other machine, wireshark output is filled with logs, like this:
> ‎51169	971.049322	192.168.1.100	128.72.252.146	STUN	174	Binding Request user: HfCr4jWnz3K7dVZZ:UB8UTDtXyOvRmKdy
51170	971.057350	128.72.252.146	192.168.1.100	ICMP	202	Destination unreachable (Port unreachable)
